### ISSUE TITLE
tcp dump for SDK crash

### ISSUE THREAD

**Issue by amitguptaRean** [awslabs/aws-iot-device-sdk-cpp-v2#42]
@JonathanHenson please look at the tcp dump for the sdk crash
I have highlighted the crash timestamp **14:52:00.049075**

**Our AWS SDK agent logger**
Jun 12 14:52:00 D16 device_agent[5056]: [14:52:00:039231472: +00:00] [---W---] [thread 5059] Connection onInterrupt
Jun 12 14:52:00 D16 device_agent[5056]: [14:52:00:039584632: +00:00] [---W---] [thread 5059] Connection Interrupted with Error libaws-c-mqtt: AWS_ERROR_MQTT_TIMEOUT, Time limit between request and response has been exceeded.
**Jun 12 14:52:00 D16 device_agent: Connection onInterrupt
Jun 12 14:52:00 D16 device_agent: Connection Interrupted with Error libaws-c-mqtt: AWS_ERROR_MQTT_TIMEOUT, Time limit between request and response has been exceeded.
Jun 12 14:52:00 D16 device_agent[5103]: [14:52:00:465911675: +00:00] [---I---] [thread 5103] Starting HV agent service...**

**OnResume() did not get called** 

**TCP dump**
14:51:53.013309 IP api-amit.5gdcs.com.8883 > 10.0.0.4.35590: Flags [.], ack 400, win 262, options [nop,nop,TS val 3932742808 ecr 19397442], length 0
14:51:55.044841 IP 10.0.0.4.35590 > api-amit.5gdcs.com.8883: Flags [P.], seq 400:500, ack 1, win 1000, options [nop,nop,TS val 19397950 ecr 3932742808], length 100
14:51:55.045240 IP api-amit.5gdcs.com.8883 > 10.0.0.4.35590: Flags [.], ack 500, win 262, options [nop,nop,TS val 3932744840 ecr 19397950], length 0
14:51:57.037940 IP 10.0.0.4.35590 > api-amit.5gdcs.com.8883: Flags [P.], seq 500:531, ack 1, win 1000, options [nop,nop,TS val 19398449 ecr 3932744840], length 31
14:51:57.038223 IP api-amit.5gdcs.com.8883 > 10.0.0.4.35590: Flags [.], ack 531, win 262, options [nop,nop,TS val 3932746833 ecr 19398449], length 0
14:51:57.038443 IP api-amit.5gdcs.com.8883 > 10.0.0.4.35590: Flags [P.], seq 1:32, ack 531, win 262, options [nop,nop,TS val 3932746833 ecr 19398449], length 31
14:51:57.038606 IP 10.0.0.4.35590 > api-amit.5gdcs.com.8883: Flags [.], ack 32, win 1000, options [nop,nop,TS val 19398449 ecr 3932746833], length 0
14:51:57.106527 IP 10.0.0.4.35590 > api-amit.5gdcs.com.8883: Flags [P.], seq 531:631, ack 32, win 1000, options [nop,nop,TS val 19398466 ecr 3932746833], length 100
14:51:57.147968 IP api-amit.5gdcs.com.8883 > 10.0.0.4.35590: Flags [.], ack 631, win 262, options [nop,nop,TS val 3932746943 ecr 19398466], length 0
14:51:59.044234 IP 10.0.0.4.35590 > api-amit.5gdcs.com.8883: Flags [P.], seq 631:731, ack 32, win 1000, options [nop,nop,TS val 19398950 ecr 3932746943], length 100
14:51:59.044441 IP api-amit.5gdcs.com.8883 > 10.0.0.4.35590: Flags [.], ack 731, win 262, options [nop,nop,TS val 3932748839 ecr 19398950], length 0
**14:52:00.049075 IP 10.0.0.4.35628 > api-amit.5gdcs.com.8883: Flags [S], seq 4008811436, win 29200, options [mss 1460,sackOK,TS val 19399201 ecr 0,nop,wscale 6], length 0**
14:52:00.049371 IP api-amit.5gdcs.com.8883 > 10.0.0.4.35628: Flags [S.], seq 3427409218, ack 4008811437, win 28960, options [mss 1460,sackOK,TS val 3932749844 ecr 19399201,nop,wscale 7], length 0
14:52:00.049615 IP 10.0.0.4.35628 > api-amit.5gdcs.com.8883: Flags [.], ack 1, win 457, options [nop,nop,TS val 19399202 ecr 3932749844], length 0
14:52:00.063295 IP 10.0.0.4.35628 > api-amit.5gdcs.com.8883: Flags [F.], seq 1, ack 1, win 457, options [nop,nop,TS val 19399205 ecr 3932749844], length 0
14:52:00.063903 IP api-amit.5gdcs.com.8883 > 10.0.0.4.35628: Flags [.], ack 2, win 227, options [nop,nop,TS val 3932749859 ecr 19399205], length 0
14:52:00.064127 IP api-amit.5gdcs.com.8883 > 10.0.0.4.35628: Flags [F.], seq 1, ack 2, win 227, options [nop,nop,TS val 3932749859 ecr 19399205], length 0
14:52:00.064300 IP 10.0.0.4.35628 > api-amit.5gdcs.com.8883: Flags [.], ack 2, win 457, options [nop,nop,TS val 19399205 ecr 3932749859], length 0
14:52:00.075802 IP 10.0.0.4.35590 > api-amit.5gdcs.com.8883: Flags [F.], seq 731, ack 32, win 1000, options [nop,nop,TS val 19399208 ecr 3932748839], length 0
14:52:00.076227 IP api-amit.5gdcs.com.8883 > 10.0.0.4.35590: Flags [P.], seq 32:63, ack 732, win 262, options [nop,nop,TS val 3932749871 ecr 19399208], length 31
14:52:00.076466 IP 10.0.0.4.35590 > api-amit.5gdcs.com.8883: Flags [R], seq 3125822068, win 0, length 0
14:52:00.076541 IP api-amit.5gdcs.com.8883 > 10.0.0.4.35590: Flags [F.], seq 63, ack 732, win 262, options [nop,nop,TS val 3932749871 ecr 19399208], length 0
14:52:00.076634 IP 10.0.0.4.35590 > api-amit.5gdcs.com.8883: Flags [R], seq 3125822068, win 0, length 0
14:52:00.640201 IP 10.0.0.4.35630 > api-amit.5gdcs.com.8883: Flags [S], seq 37084101, win 29200, options [mss 1460,sackOK,TS val 19399349 ecr 0,nop,wscale 6], length 0
14:52:00.640452 IP api-amit.5gdcs.com.8883 > 10.0.0.4.35630: Flags [S.], seq 1148298085, ack 37084102, win 28960, options [mss 1460,sackOK,TS val 3932750435 ecr 19399349,nop,wscale 7], length 0
14:52:00.640642 IP 10.0.0.4.35630 > api-amit.5gdcs.com.8883: Flags [.], ack 1, win 457, options [nop,nop,TS val 19399349 ecr 3932750435], length 0
14:52:00.650125 IP 10.0.0.4.35630 > api-amit.5gdcs.com.8883: Flags [P.], seq 1:147, ack 1, win 457, options [nop,nop,TS val 19399352 ecr 3932750435], length 146
14:52:00.650530 IP api-amit.5gdcs.com.8883 > 10.0.0.4.35630: Flags [.], ack 147, win 235, options [nop,nop,TS val 3932750445 ecr 19399352], length 0
14:52:00.657672 IP api-amit.5gdcs.com.8883 > 10.0.0.4.35630: Flags [.], seq 1:1449, ack 147, win 235, options [nop,nop,TS val 3932750452 ecr 19399352], length 1448
14:52:00.657875 IP 10.0.0.4.35630 > api-amit.5gdcs.com.8883: Flags [.], ack 1449, win 502, options [nop,nop,TS val 19399354 ecr 3932750452], length 0
14:52:00.657972 IP api-amit.5gdcs.com.8883 > 10.0.0.4.35630: Flags [P.], seq 1449:1749, ack 147, win 235, options [nop,nop,TS val 3932750452 ecr 19399352], length 300
